Código;Programa;Instituição de Ensino;Área de Avaliação;Área Básica;Situação;Modalidade;ME;DO;MP;DP
32064012001P7;ADMINISTRAÇÃO;FACULDADE DE ESTUDOS ADMINISTRATIVOS DE MINAS GERAIS        ;ADMINISTRAÇÃO PÚBLICA E DE EMPRESAS, CIÊNCIAS CONTÁBEIS E TURISMO;ADMINISTRAÇÃO;EM DESATIVACAO;PROFISSIONAL;-;-;2;-
32037015003P3;ADMINISTRAÇÃO;CENTRO UNIVERSITARIO UNA;ADMINISTRAÇÃO PÚBLICA E DE EMPRESAS, CIÊNCIAS CONTÁBEIS E TURISMO;ADMINISTRAÇÃO;EM DESATIVACAO;PROFISSIONAL;-;-;3;-
33149011003P8;ADMINISTRAÇÃO DAS MICRO E PEQUENAS EMPRESAS;CENTRO UNIVERSITÁRIO CAMPO LIMPO PAULISTA;ADMINISTRAÇÃO PÚBLICA E DE EMPRESAS, CIÊNCIAS CONTÁBEIS E TURISMO;ADMINISTRAÇÃO DE EMPRESAS;EM DESATIVACAO;PROFISSIONAL;-;-;-;4
33128014001P5;Agronegócio;ESCOLA DE ECONOMIA DE SÃO PAULO;CIÊNCIAS AGRÁRIAS I                               ;AGRONOMIA;EM DESATIVACAO;PROFISSIONAL;-;-;4;-
21001014018P6;AGRONOMIA - SOLOS E NUTRIÇÃO DE PLANTAS;FUNDAÇÃO UNIVERSIDADE FEDERAL DO PIAUÍ;CIÊNCIAS AGRÁRIAS I                               ;CIÊNCIA DO SOLO;EM DESATIVACAO;ACADÊMICO;3;-;-;-
33004064021P7;AGRONOMIA (ENERGIA NA AGRICULTURA);UNIVERSIDADE ESTADUAL PAULISTA JÚLIO DE MESQUITA FILHO ( BOTUCATU );CIÊNCIAS AGRÁRIAS I                               ;AGRONOMIA;EM DESATIVACAO;ACADÊMICO;4;4;-;-
52001016033P2;AGRONOMIA (Produção Vegetal);UNIVERSIDADE FEDERAL DE GOIÁS;CIÊNCIAS AGRÁRIAS I                               ;AGRONOMIA;EM DESATIVACAO;ACADÊMICO;3;-;-;-
33004030055P6;ALIMENTOS E NUTRIÇÃO;UNIVERSIDADE ESTADUAL PAULISTA JÚLIO DE MESQUITA FILHO ( ARARAQUARA );CIÊNCIA DE ALIMENTOS                              ;CIÊNCIA E TECNOLOGIA DE ALIMENTOS;EM DESATIVACAO;ACADÊMICO;4;4;-;-
33020019007P5;ARQUITETURA E URBANISMO;UNIVERSIDADE CATÓLICA DE SANTOS;ARQUITETURA, URBANISMO E DESIGN;ARQUITETURA E URBANISMO;EM DESATIVACAO;PROFISSIONAL;-;-;A;-
42043018004P4;Arquitetura e Urbanismo;CENTRO UNIVERSITÁRIO RITTER DOS REIS;ARQUITETURA, URBANISMO E DESIGN;ARQUITETURA E URBANISMO;EM DESATIVACAO;ACADÊMICO;4;-;-;-
21001014033P5;Artes, Patrimônio e Museologia;FUNDAÇÃO UNIVERSIDADE FEDERAL DO PIAUÍ;COMUNICAÇÃO E INFORMAÇÃO;MUSEOLOGIA;EM DESATIVACAO;PROFISSIONAL;-;-;3;-
42002010162P9;ARTES VISUAIS;UNIVERSIDADE FEDERAL DE SANTA MARIA;ARTES;ARTES;EM DESATIVACAO;ACADÊMICO;-;A;-;-
33078017008P1;ASTROFÍSICA E FÍSICA COMPUTACIONAL;UNIVERSIDADE CRUZEIRO DO SUL;ASTRONOMIA / FÍSICA                               ;ASTRONOMIA;EM DESATIVACAO;ACADÊMICO;4;-;-;-
33084017001P3;AUTOMAÇÃO E CONTROLE DE PROCESSOS;INSTITUTO FEDERAL DE EDUCAÇÃO, CIÊNCIA E TECNOLOGIA DE SÃO PAULO;ENGENHARIAS III                                   ;ENGENHARIA MECÂNICA;EM DESATIVACAO;PROFISSIONAL;-;-;2;-
52001016105P3;BIOCIÊNCIA ANIMAL;UNIVERSIDADE FEDERAL DE GOIÁS;MEDICINA VETERINÁRIA                              ;MEDICINA VETERINÁRIA;EM DESATIVACAO;ACADÊMICO;4;-;-;-
42042011002P5;Biociências e Reabilitação;CENTRO UNIVERSITÁRIO METODISTA IPA;INTERDISCIPLINAR                                  ;SAÚDE E BIOLÓGICAS;EM DESATIVACAO;ACADÊMICO;4;-;-;-
52001016054P0;Biodiversidade Vegetal;UNIVERSIDADE FEDERAL DE GOIÁS;BIODIVERSIDADE;BOTÂNICA;EM DESATIVACAO;ACADÊMICO;2;-;-;-
33051011004P8;BIOENGENHARIA;UNIVERSIDADE DO VALE DO PARAÍBA;ENGENHARIAS IV                                    ;ENGENHARIA BIOMÉDICA;EM DESATIVACAO;PROFISSIONAL;-;-;3;-
32073011004P1;BIOÉTICA;UNIVERSIDADE DO VALE DO SAPUCAI;INTERDISCIPLINAR                                  ;SAÚDE E BIOLÓGICAS;EM DESATIVACAO;ACADÊMICO;3;-;-;-
33003017040P8;BIOLOGIA FUNCIONAL E MOLECULAR;UNIVERSIDADE ESTADUAL DE CAMPINAS;CIÊNCIAS BIOLÓGICAS II                            ;BIOQUÍMICA;EM DESATIVACAO;ACADÊMICO;6;6;-;-
33067015003P1;BIOLOGIA ORAL;CENTRO UNIVERSITÁRIO SAGRADO CORAÇÃO;ODONTOLOGIA                                       ;ODONTOLOGIA;EM DESATIVACAO;ACADÊMICO;4;4;-;-
33004145081P0;BIOPATOLOGIA BUCAL;UNIVERSIDADE ESTADUAL PAULISTA JÚLIO DE MESQUITA FILHO ( SÃO JOSÉ DOS CAMPOS );ODONTOLOGIA                                       ;ODONTOLOGIA;EM DESATIVACAO;ACADÊMICO;5;5;-;-
21001014025P2;BIOTECNOLOGIA;FUNDAÇÃO UNIVERSIDADE FEDERAL DO PIAUÍ;BIOTECNOLOGIA                                     ;BIOTECNOLOGIA;EM DESATIVACAO;ACADÊMICO;4;4;-;-
23004010007P9;BIOTECNOLOGIA;UNIVERSIDADE POTIGUAR;BIOTECNOLOGIA                                     ;BIOTECNOLOGIA;EM DESATIVACAO;ACADÊMICO;3;-;-;-
42008018010P9;BIOTECNOLOGIA E GESTÃO VITIVINÍCOLA;UNIVERSIDADE DE CAXIAS DO SUL;BIOTECNOLOGIA                                     ;BIOTECNOLOGIA;EM DESATIVACAO;PROFISSIONAL;-;-;4;-
53001010038P0;BOTÂNICA;UNIVERSIDADE DE BRASÍLIA;BIODIVERSIDADE;BOTÂNICA;EM DESATIVACAO;ACADÊMICO;3;2;-;-
28007018013P1;Botânica;UNIVERSIDADE ESTADUAL DE SANTA CRUZ;BIODIVERSIDADE;BOTÂNICA;EM DESATIVACAO;ACADÊMICO;2;-;-;-
32011016008P3;Ciência e Engenharia de Materiais;UNIVERSIDADE FEDERAL DE ALFENAS;ENGENHARIAS II                                    ;ENGENHARIA DE MATERIAIS E METALÚRGICA;EM DESATIVACAO;ACADÊMICO;3;-;-;-
40024016002P9;CIÊNCIA E TECNOLOGIA DE LEITE E DERIVADOS;UNIVERSIDADE PITÁGORAS UNOPAR;CIÊNCIA DE ALIMENTOS                              ;CIÊNCIA E TECNOLOGIA DE ALIMENTOS;EM DESATIVACAO;ACADÊMICO;3;-;-;-
31032010005P5;CIÊNCIA POLÍTICA (CIÊNCIA POLÍTICA E SOCIOLOGIA);UNIVERSIDADE CÂNDIDO MENDES;CIÊNCIA POLÍTICA E RELAÇÕES INTERNACIONAIS        ;CIÊNCIA POLÍTICA;EM DESATIVACAO;ACADÊMICO;2;2;-;-
40030016005P4;CIÊNCIA, TECNOLOGIA E SEGURANÇA ALIMENTAR;UNIVERSIDADE CESUMAR;INTERDISCIPLINAR                                  ;MEIO AMBIENTE E AGRÁRIAS;EM DESATIVACAO;ACADÊMICO;3;-;-;-
15002012003P8;CIÊNCIAS AGRÁRIAS;UNIVERSIDADE FEDERAL RURAL DA AMAZÔNIA;CIÊNCIAS AGRÁRIAS I                               ;RECURSOS FLORESTAIS E ENGENHARIA FLORESTAL;EM DESATIVACAO;ACADÊMICO;-;3;-;-
52010015001P9;CIÊNCIAS AGRÁRIAS;INSTITUTO FEDERAL DE EDUCAÇÃO, CIÊNCIA E TECNOLOGIA GOIANO;CIÊNCIAS AGRÁRIAS I                               ;AGRONOMIA;EM DESATIVACAO;ACADÊMICO;3;-;-;-
52001016059P1;Ciências Aplicadas à Saúde;UNIVERSIDADE FEDERAL DE GOIÁS;INTERDISCIPLINAR                                  ;SAÚDE E BIOLÓGICAS;EM DESATIVACAO;ACADÊMICO;3;-;-;-
32009011001P8;CIÊNCIAS BIOLÓGICAS;UNIVERSIDADE VALE DO RIO DOCE;CIÊNCIAS BIOLÓGICAS I                             ;BIOLOGIA GERAL;EM DESATIVACAO;ACADÊMICO;2;-;-;-
33051011009P0;Ciencias Biologicas;UNIVERSIDADE DO VALE DO PARAÍBA;CIÊNCIAS BIOLÓGICAS I                             ;BIOLOGIA GERAL;EM DESATIVACAO;ACADÊMICO;2;-;-;-
33004137005P6;CIÊNCIAS BIOLÓGICAS (BIOLOGIA VEGETAL);UNIVERSIDADE ESTADUAL PAULISTA JÚLIO DE MESQUITA FILHO ( RIO CLARO );BIODIVERSIDADE;BOTÂNICA;EM DESATIVACAO;ACADÊMICO;5;5;-;-
33004137041P2;CIÊNCIAS BIOLÓGICAS (MICROBIOLOGIA APLICADA);UNIVERSIDADE ESTADUAL PAULISTA JÚLIO DE MESQUITA FILHO ( RIO CLARO );CIÊNCIAS AGRÁRIAS I                               ;AGRONOMIA;EM DESATIVACAO;ACADÊMICO;5;5;-;-
33004137003P3;CIÊNCIAS BIOLÓGICAS (ZOOLOGIA);UNIVERSIDADE ESTADUAL PAULISTA JÚLIO DE MESQUITA FILHO ( RIO CLARO );BIODIVERSIDADE;ZOOLOGIA;EM DESATIVACAO;ACADÊMICO;4;4;-;-
21001014034P1;Ciências Biomédicas;FUNDAÇÃO UNIVERSIDADE FEDERAL DO PIAUÍ;MEDICINA I                                        ;MEDICINA;EM DESATIVACAO;ACADÊMICO;3;-;-;-
12001015032P3;CIÊNCIAS DA COMUNICAÇÃO;UNIVERSIDADE FEDERAL DO AMAZONAS;COMUNICAÇÃO E INFORMAÇÃO;COMUNICAÇÃO;EM DESATIVACAO;ACADÊMICO;2;-;-;-
25001019039P4;CIÊNCIAS DA SAÚDE;UNIVERSIDADE FEDERAL DE PERNAMBUCO;MEDICINA I                                        ;CLÍNICA MÉDICA;EM DESATIVACAO;ACADÊMICO;2;-;-;-
12001015004P0;CIÊNCIAS DE ALIMENTOS;UNIVERSIDADE FEDERAL DO AMAZONAS;CIÊNCIA DE ALIMENTOS                              ;CIÊNCIA E TECNOLOGIA DE ALIMENTOS;EM DESATIVACAO;ACADÊMICO;2;-;-;-
52001016103P0;CIÊNCIAS EXATAS E TECNOLÓGICAS;UNIVERSIDADE FEDERAL DE GOIÁS;MATERIAIS                                         ;MATERIAIS;EM DESATIVACAO;ACADÊMICO;-;4;-;-
31002013029P2;Ciências Fisiológicas;UNIVERSIDADE FEDERAL RURAL DO RIO DE JANEIRO;CIÊNCIAS BIOLÓGICAS II                            ;FISIOLOGIA;EM DESATIVACAO;ACADÊMICO;2;2;-;-
15002012002P1;CIÊNCIAS FLORESTAIS;UNIVERSIDADE FEDERAL RURAL DA AMAZÔNIA;CIÊNCIAS AGRÁRIAS I                               ;RECURSOS FLORESTAIS E ENGENHARIA FLORESTAL;EM DESATIVACAO;ACADÊMICO;3;-;-;-
33035016001P0;CIÊNCIAS ODONTOLÓGICAS;CENTRO UNIVERSITÁRIO DA FUNDAÇÃO EDUCACIONAL DE BARRETOS;ODONTOLOGIA                                       ;ODONTOLOGIA;EM DESATIVACAO;PROFISSIONAL;-;-;3;-
33004102069P8;CIRURGIA VETERINÁRIA;UNIVERSIDADE ESTADUAL PAULISTA JÚLIO DE MESQUITA FILHO ( JABOTICABAL );MEDICINA VETERINÁRIA                              ;MEDICINA VETERINÁRIA;EM DESATIVACAO;ACADÊMICO;5;5;-;-
33077010001P0;CLÍNICA MÉDICA;CENTRO UNIVERSITÁRIO LUSÍADA                                ;MEDICINA I                                        ;MEDICINA;EM DESATIVACAO;ACADÊMICO;2;-;-;-
32021011001P0;CLÍNICA ODONTOLÓGICA;UNIVERSIDADE VALE DO RIO VERDE;ODONTOLOGIA                                       ;ODONTOLOGIA;EM DESATIVACAO;ACADÊMICO;2;-;-;-
25003011037P4;CONSUMO, COTIDIANO E DESENVOLVIMENTO SOCIAL;UNIVERSIDADE FEDERAL RURAL DE PERNAMBUCO;SERVIÇO SOCIAL                                    ;ECONOMIA DOMÉSTICA;EM DESATIVACAO;ACADÊMICO;2;-;-;-
16003012172P3;DEMANDAS POPULARES E DINÂMICAS REGIONAIS;FUNDAÇÃO UNIVERSIDADE FEDERAL DO TOCANTINS;PLANEJAMENTO URBANO E REGIONAL / DEMOGRAFIA       ;PLANEJAMENTO URBANO E REGIONAL;EM DESATIVACAO;ACADÊMICO;3;-;-;-
28011015003P0;DESENVOLVIMENTO HUMANO E RESPONSABILIDADE SOCIAL;FUNDACAO VISCONDE DE CAIRU                                  ;INTERDISCIPLINAR                                  ;SOCIAIS E HUMANIDADES;EM DESATIVACAO;PROFISSIONAL;-;-;2;-
11001011002P4;DESENVOLVIMENTO REGIONAL;UNIVERSIDADE FEDERAL DO ACRE;INTERDISCIPLINAR                                  ;MEIO AMBIENTE E AGRÁRIAS;EM DESATIVACAO;ACADÊMICO;2;-;-;-
32081014001P1;Desenvolvimento Regional;INSTITUTO DE ENSINO SUPERIOR E PESQUISA;PLANEJAMENTO URBANO E REGIONAL / DEMOGRAFIA       ;PLANEJAMENTO URBANO E REGIONAL;EM DESATIVACAO;PROFISSIONAL;-;-;2;-
13001019009P4;DESENVOLVIMENTO REGIONAL DA AMAZÔNIA;FUNDAÇÃO UNIVERSIDADE FEDERAL DE RORAIMA;PLANEJAMENTO URBANO E REGIONAL / DEMOGRAFIA       ;PLANEJAMENTO URBANO E REGIONAL;EM DESATIVACAO;ACADÊMICO;2;-;-;-
22001018076P9;DESENVOLVIMENTO REGIONAL SUSTENTÁVEL;UNIVERSIDADE FEDERAL DO CEARÁ;CIÊNCIAS AMBIENTAIS;CIÊNCIAS AMBIENTAIS;EM DESATIVACAO;ACADÊMICO;3;-;-;-
15001016074P6;Dinâmicas Territoriais e Sociedade na Amazônia;UNIVERSIDADE FEDERAL DO PARÁ;INTERDISCIPLINAR                                  ;MEIO AMBIENTE E AGRÁRIAS;EM DESATIVACAO;ACADÊMICO;3;-;-;-
52002012014P4;DIREITO, RELAÇÕES INTERNACIONAIS E DESENVOLVIMENTO;PONTIFÍCIA UNIVERSIDADE CATÓLICA DE GOIÁS;INTERDISCIPLINAR                                  ;SOCIAIS E HUMANIDADES;EM DESATIVACAO;ACADÊMICO;2;-;-;-
53017013001P6;DIREITOS HUMANOS, CIDADANIA E VIOLÊNCIA;CENTRO UNIVERSITÁRIO EURO-AMERICANO;CIÊNCIA POLÍTICA E RELAÇÕES INTERNACIONAIS        ;CIÊNCIA POLÍTICA;EM DESATIVACAO;ACADÊMICO;3;-;-;-
12001015020P5;DIVERSIDADE BIOLÓGICA;UNIVERSIDADE FEDERAL DO AMAZONAS;BIODIVERSIDADE;ECOLOGIA APLICADA;EM DESATIVACAO;ACADÊMICO;2;2;-;-
30011019001P3;ECOLOGIA DE ECOSSISTEMAS;UNIVERSIDADE VILA VELHA;BIODIVERSIDADE;ECOLOGIA DE ECOSSISTEMAS;EM DESATIVACAO;ACADÊMICO;3;2;-;-
52002012005P5;ECOLOGIA E PRODUÇÃO SUSTENTÁVEL;PONTIFÍCIA UNIVERSIDADE CATÓLICA DE GOIÁS;INTERDISCIPLINAR                                  ;MEIO AMBIENTE E AGRÁRIAS;EM DESATIVACAO;ACADÊMICO;2;-;-;-
33053014002P8;EDUCAÇÃO;CENTRO UNIVERSITÁRIO MOURA LACERDA;EDUCAÇÃO                                          ;EDUCAÇÃO;EM DESATIVACAO;ACADÊMICO;3;-;-;-
52001016063P9;Educação;UNIVERSIDADE FEDERAL DE GOIÁS;EDUCAÇÃO                                          ;EDUCAÇÃO;EM DESATIVACAO;ACADÊMICO;3;-;-;-
52001016052P7;EDUCAÇÃO - CAMPUS CATALÃO;UNIVERSIDADE FEDERAL DE GOIÁS;EDUCAÇÃO                                          ;EDUCAÇÃO;EM DESATIVACAO;ACADÊMICO;3;-;-;-
33153019001P9;Educação, Ambiente e Sociedade;CENTRO UNIVERSITÁRIO DAS FACULDADES ASSOCIADAS DE ENSINO ? FAE;INTERDISCIPLINAR                                  ;SOCIAIS E HUMANIDADES;EM DESATIVACAO;ACADÊMICO;2;-;-;-
33009015084P3;EDUCAÇÃO E SAÚDE NA INFÂNCIA E ADOLESCÊNCIA;UNIVERSIDADE FEDERAL DE SÃO PAULO;ENSINO;ENSINO;EM DESATIVACAO;ACADÊMICO;-;4;-;-
32058020002P2;EDUCAÇÃO EM DIABETES;FACULDADE SANTA CASA DE BELO HORIZONTE;MEDICINA I                                        ;ENDOCRINOLOGIA;EM DESATIVACAO;PROFISSIONAL;-;-;2;-
28013018003P2;Energia;UNIVERSIDADE SALVADOR;INTERDISCIPLINAR                                  ;ENGENHARIA/TECNOLOGIA/GESTÃO;EM DESATIVACAO;PROFISSIONAL;-;-;3;-
26001012037P4;Energia da Biomassa;UNIVERSIDADE FEDERAL DE ALAGOAS;INTERDISCIPLINAR                                  ;ENGENHARIA/TECNOLOGIA/GESTÃO;EM DESATIVACAO;PROFISSIONAL;-;-;2;-
33002010192P6;ENGENHARIA AUTOMOTIVA;UNIVERSIDADE DE SÃO PAULO;ENGENHARIAS III                                   ;ENGENHARIA MECÂNICA;EM DESATIVACAO;PROFISSIONAL;-;-;1;-
52001016017P7;ENGENHARIA CIVIL;UNIVERSIDADE FEDERAL DE GOIÁS;ENGENHARIAS I                                     ;ENGENHARIA CIVIL;EM DESATIVACAO;ACADÊMICO;2;-;-;-
12001015022P8;ENGENHARIA CIVIL;UNIVERSIDADE FEDERAL DO AMAZONAS;ENGENHARIAS I                                     ;ENGENHARIA CIVIL;EM DESATIVACAO;ACADÊMICO;2;-;-;-
23001011051P9;ENGENHARIA CIVIL;UNIVERSIDADE FEDERAL DO RIO GRANDE DO NORTE;ENGENHARIAS I                                     ;ENGENHARIA CIVIL;EM DESATIVACAO;ACADÊMICO;3;-;-;-
52001016112P0;ENGENHARIA CIVIL;UNIVERSIDADE FEDERAL DE GOIÁS;ENGENHARIAS I                                     ;ENGENHARIA CIVIL;EM DESATIVACAO;ACADÊMICO;A;-;-;-
33083010003P0;ENGENHARIA DE COMPUTAÇÃO;INSTITUTO DE PESQUISAS TECNOLÓGICAS DO ESTADO DE SÃO PAULO;ENGENHARIAS IV                                    ;ENGENHARIA ELÉTRICA;EM DESATIVACAO;PROFISSIONAL;-;-;2;-
50001019022P5;ENGENHARIA DE EDIFICAÇÕES E AMBIENTAL;UNIVERSIDADE FEDERAL DE MATO GROSSO;ENGENHARIAS I                                     ;ENGENHARIA CIVIL;EM DESATIVACAO;ACADÊMICO;2;-;-;-
42019010014P6;Engenharia de Materiais e Processos Sustentáveis;UNIVERSIDADE LUTERANA DO BRASIL;ENGENHARIAS II                                    ;ENGENHARIA DE MATERIAIS E METALÚRGICA;EM DESATIVACAO;PROFISSIONAL;-;-;3;-
42001013086P0;ENGENHARIA DE MINAS, METALÚRGICA E DE MATERIAIS;UNIVERSIDADE FEDERAL DO RIO GRANDE DO SUL;ENGENHARIAS II                                    ;ENGENHARIA DE MATERIAIS E METALÚRGICA;EM DESATIVACAO;PROFISSIONAL;-;-;2;-
23004010003P3;Engenharia de Processos;UNIVERSIDADE POTIGUAR;ENGENHARIAS II                                    ;PETRÓLEO E PETROQUÍMICA;EM DESATIVACAO;PROFISSIONAL;-;-;3;-
33069018001P1;ENGENHARIA DE PROCESSOS QUÍMICOS E BIOQUÍMICOS;CENTRO UNIVERSITÁRIO DO INSTITUTO MAUÁ DE TECNOLOGIA;ENGENHARIAS II                                    ;ENGENHARIA QUÍMICA;EM DESATIVACAO;ACADÊMICO;2;-;-;-
24001015012P6;ENGENHARIA DE PRODUÇÃO;UNIVERSIDADE FEDERAL DA PARAÍBA ( JOÃO PESSOA );ENGENHARIAS III                                   ;ENGENHARIA DE PRODUÇÃO;EM DESATIVACAO;ACADÊMICO;2;-;-;-
31033016003P5;ENGENHARIA DE PRODUÇÃO;UNIVERSIDADE ESTADUAL DO NORTE FLUMINENSE DARCY RIBEIRO;ENGENHARIAS III                                   ;ENGENHARIA DE PRODUÇÃO;EM DESATIVACAO;ACADÊMICO;2;-;-;-
33004080053P7;ENGENHARIA DE PRODUÇÃO;UNIVERSIDADE ESTADUAL PAULISTA JÚLIO DE MESQUITA FILHO ( GUARATINGUETÁ );ENGENHARIAS III                                   ;ENGENHARIA DE PRODUÇÃO;EM DESATIVACAO;ACADÊMICO;3;-;-;-
52001016106P0;ENGENHARIA DE PRODUÇÃO;UNIVERSIDADE FEDERAL DE GOIÁS;ENGENHARIAS III                                   ;ENGENHARIA DE PRODUÇÃO;EM DESATIVACAO;ACADÊMICO;3;-;-;-
40006018029P3;Engenharia Mecânica;UNIVERSIDADE TECNOLÓGICA FEDERAL DO PARANÁ;ENGENHARIAS III                                   ;ENGENHARIA MECÂNICA;EM DESATIVACAO;ACADÊMICO;3;-;-;-
33021015014P8;Engenharia Mecânica;UNIVERSIDADE DE TAUBATÉ;ENGENHARIAS III                                   ;ENGENHARIA MECÂNICA;EM DESATIVACAO;ACADÊMICO;3;-;-;-
31003010077P7;Engenharia Mecânica - Volta Redonda;UNIVERSIDADE FEDERAL FLUMINENSE;ENGENHARIAS III                                   ;ENGENHARIA MECÂNICA;EM DESATIVACAO;ACADÊMICO;2;-;-;-
25001019061P0;ENGENHARIA MINERAL;UNIVERSIDADE FEDERAL DE PERNAMBUCO;ENGENHARIAS II                                    ;ENGENHARIA DE MINAS;EM DESATIVACAO;ACADÊMICO;2;-;-;-
51001012172P0;ENSINO DE CIÊNCIAS;FUNDAÇÃO UNIVERSIDADE FEDERAL DE MATO GROSSO DO SUL;ENSINO;ENSINO DE CIÊNCIAS E MATEMÁTICA;EM DESATIVACAO;ACADÊMICO;-;4;-;-
31050018003P0;Ensino de Ciências;INSTITUTO FEDERAL DE EDUCACAO, CIENCIA E TECNOLOGIA DO RIO DE JANEIRO;ENSINO;ENSINO DE CIÊNCIAS E MATEMÁTICA;EM DESATIVACAO;ACADÊMICO;3;-;-;-
31059015001P4;ENSINO DE CIÊNCIAS DA SAÚDE E DO AMBIENTE;CENTRO UNIVERSITARIO PLINIO LEITE                           ;ENSINO;ENSINO DE CIÊNCIAS E MATEMÁTICA;EM DESATIVACAO;PROFISSIONAL;-;-;2;-
16003012173P0;ENSINO DE CIÊNCIAS E MATEMÁTICA;FUNDAÇÃO UNIVERSIDADE FEDERAL DO TOCANTINS;ENSINO;ENSINO;EM DESATIVACAO;ACADÊMICO;A;-;-;-
42001013081P9;ENSINO DE MATEMÁTICA;UNIVERSIDADE FEDERAL DO RIO GRANDE DO SUL;ENSINO;ENSINO DE CIÊNCIAS E MATEMÁTICA;EM DESATIVACAO;PROFISSIONAL;-;-;5;-
10001018013P3;Ensino em Ciências da Saúde;UNIVERSIDADE FEDERAL DE RONDÔNIA;INTERDISCIPLINAR                                  ;SAÚDE E BIOLÓGICAS;EM DESATIVACAO;PROFISSIONAL;-;-;1;-
42003016046P1;ENTOMOLOGIA;UNIVERSIDADE FEDERAL DE PELOTAS;CIÊNCIAS AGRÁRIAS I                               ;AGRONOMIA;EM DESATIVACAO;ACADÊMICO;3;-;-;-
32053010004P8;Estudos Culturais Contemporâneos;UNIVERSIDADE FUMEC;INTERDISCIPLINAR                                  ;SOCIAIS E HUMANIDADES;EM DESATIVACAO;ACADÊMICO;3;-;-;-
52001016049P6;ESTUDOS DA LINGUAGEM;UNIVERSIDADE FEDERAL DE GOIÁS;LINGUíSTICA E LITERATURA;LETRAS;EM DESATIVACAO;ACADÊMICO;4;4;-;-
16003012158P0;ESTUDOS DE CULTURA E TERRITÓRIO;FUNDAÇÃO UNIVERSIDADE FEDERAL DO TOCANTINS;INTERDISCIPLINAR                                  ;SOCIAIS E HUMANIDADES;EM DESATIVACAO;ACADÊMICO;3;-;-;-
25003011016P7;EXTENSÃO RURAL E DESENVOLVIMENTO LOCAL;UNIVERSIDADE FEDERAL RURAL DE PERNAMBUCO;CIÊNCIAS AGRÁRIAS I                               ;EXTENSÃO RURAL;EM DESATIVACAO;ACADÊMICO;2;-;-;-
33004064052P0;FARMACOLOGIA E BIOTECNOLOGIA;UNIVERSIDADE ESTADUAL PAULISTA JÚLIO DE MESQUITA FILHO ( BOTUCATU );CIÊNCIAS BIOLÓGICAS II                            ;FARMACOLOGIA;EM DESATIVACAO;ACADÊMICO;4;4;-;-
25001019071P5;FILOSOFIA;UNIVERSIDADE FEDERAL DE PERNAMBUCO;FILOSOFIA;FILOSOFIA;EM DESATIVACAO;ACADÊMICO;2;-;-;-
24001015046P8;FILOSOFIA (UFPE-UFPB-UFRN);UNIVERSIDADE FEDERAL DE PERNAMBUCO;FILOSOFIA;FILOSOFIA;EM DESATIVACAO;ACADÊMICO;-;2;-;-
24001015046P8;FILOSOFIA (UFPE-UFPB-UFRN);UNIVERSIDADE FEDERAL DO RIO GRANDE DO NORTE;FILOSOFIA;FILOSOFIA;EM DESATIVACAO;ACADÊMICO;-;2;-;-
24001015046P8;FILOSOFIA (UFPE-UFPB-UFRN);UNIVERSIDADE FEDERAL DA PARAÍBA ( JOÃO PESSOA );FILOSOFIA;FILOSOFIA;EM DESATIVACAO;ACADÊMICO;-;2;-;-
13001019002P0;FÍSICA;FUNDAÇÃO UNIVERSIDADE FEDERAL DE RORAIMA;ASTRONOMIA / FÍSICA                               ;FÍSICA;EM DESATIVACAO;ACADÊMICO;2;-;-;-
32003013006P1;FÍSICA E MATEMÁTICA APLICADA;UNIVERSIDADE FEDERAL DE ITAJUBÁ;ASTRONOMIA / FÍSICA                               ;"FÍSICA CLÁSSICA E FÍSICA QUÂNTICA; MECÂNICA E CAMPOS";EM DESATIVACAO;ACADÊMICO;3;-;-;-
33004129045P2;FISIOTERAPIA;UNIVERSIDADE ESTADUAL PAULISTA JÚLIO DE MESQUITA FILHO ( PRESIDENTE PRUDENTE );EDUCAÇÃO FÍSICA                                   ;FISIOTERAPIA E TERAPIA OCUPACIONAL;EM DESATIVACAO;ACADÊMICO;5;5;-;-
31030017002P0;FONOAUDIOLOGIA;UNIVERSIDADE VEIGA DE ALMEIDA;EDUCAÇÃO FÍSICA                                   ;FONOAUDIOLOGIA;EM DESATIVACAO;PROFISSIONAL;-;-;2;-
28001010084P1;Genética e Biodiversidade;UNIVERSIDADE FEDERAL DA BAHIA;BIODIVERSIDADE;BOTÂNICA;EM DESATIVACAO;ACADÊMICO;3;-;-;-
33004102030P4;GENÉTICA E MELHORAMENTO ANIMAL;UNIVERSIDADE ESTADUAL PAULISTA JÚLIO DE MESQUITA FILHO ( JABOTICABAL );ZOOTECNIA / RECURSOS PESQUEIROS                   ;GENÉTICA E MELHORAMENTO DOS ANIMAIS DOMÉSTICOS;EM DESATIVACAO;ACADÊMICO;6;6;-;-
33005010031P5;GEOGRAFIA;PONTIFÍCIA UNIVERSIDADE CATÓLICA DE SÃO PAULO;GEOGRAFIA                                         ;GEOGRAFIA;EM DESATIVACAO;ACADÊMICO;2;-;-;-
52001016042P1;GEOGRAFIA ( CAMPUS CATALÃO );UNIVERSIDADE FEDERAL DE GOIÁS;GEOGRAFIA                                         ;GEOGRAFIA;EM DESATIVACAO;ACADÊMICO;3;-;-;-
52001016045P0;GEOGRAFIA ( CAMPUS JATAI );UNIVERSIDADE FEDERAL DE GOIÁS;GEOGRAFIA                                         ;GEOGRAFIA;EM DESATIVACAO;ACADÊMICO;4;4;-;-
33005010028P4;GERONTOLOGIA;PONTIFÍCIA UNIVERSIDADE CATÓLICA DE SÃO PAULO;INTERDISCIPLINAR                                  ;SAÚDE E BIOLÓGICAS;EM DESATIVACAO;ACADÊMICO;2;-;-;-
40022013002P6;GESTÃO AMBIENTAL;UNIVERSIDADE POSITIVO;CIÊNCIAS AMBIENTAIS;CIÊNCIAS AMBIENTAIS;EM DESATIVACAO;PROFISSIONAL;-;-;5;-
22001018075P2;Gestão de Recursos Hídricos;UNIVERSIDADE FEDERAL DO CEARÁ;ENGENHARIAS I                                     ;ENGENHARIA CIVIL;EM DESATIVACAO;PROFISSIONAL;-;-;3;-
33092010015P7;Gestão do Esporte;UNIVERSIDADE NOVE DE JULHO;ADMINISTRAÇÃO PÚBLICA E DE EMPRESAS, CIÊNCIAS CONTÁBEIS E TURISMO;ADMINISTRAÇÃO;EM DESATIVACAO;PROFISSIONAL;-;-;3;-
40015017024P7;Gestão e Desenvolvimento Regional;UNIVERSIDADE ESTADUAL DO OESTE DO PARANA;ADMINISTRAÇÃO PÚBLICA E DE EMPRESAS, CIÊNCIAS CONTÁBEIS E TURISMO;ADMINISTRAÇÃO;EM DESATIVACAO;ACADÊMICO;2;-;-;-
52001016061P6;GESTÃO ORGANIZACIONAL;UNIVERSIDADE FEDERAL DE GOIÁS;INTERDISCIPLINAR                                  ;ENGENHARIA/TECNOLOGIA/GESTÃO;EM DESATIVACAO;PROFISSIONAL;-;-;4;-
32037015002P7;GESTÃO SOCIAL, EDUCAÇÃO E DESENVOLVIMENTO LOCAL;CENTRO UNIVERSITARIO UNA;INTERDISCIPLINAR                                  ;SOCIAIS E HUMANIDADES;EM DESATIVACAO;PROFISSIONAL;-;-;4;-
32080018001P5;Hermenêutica e Direitos Fundamentais;UNIVERSIDADE PRESIDENTE ANTONIO CARLOS;DIREITO                                           ;TEORIA DO DIREITO;EM DESATIVACAO;ACADÊMICO;2;-;-;-
31021018023P1;HISTORIA;UNIVERSIDADE FEDERAL DO ESTADO DO RIO DE JANEIRO;HISTÓRIA                                          ;HISTÓRIA;EM DESATIVACAO;ACADÊMICO;-;4;-;-
52001016066P8;HISTORIA;UNIVERSIDADE FEDERAL DE GOIÁS;HISTÓRIA                                          ;HISTÓRIA;EM DESATIVACAO;PROFISSIONAL;-;-;3;-
31027016001P6;HISTÓRIA;UNIVERSIDADE DE VASSOURAS;HISTÓRIA                                          ;HISTÓRIA;EM DESATIVACAO;ACADÊMICO;2;-;-;-
33004048018P5;HISTÓRIA;UNIVERSIDADE ESTADUAL PAULISTA JÚLIO DE MESQUITA FILHO ( ASSIS );HISTÓRIA                                          ;HISTÓRIA;EM DESATIVACAO;ACADÊMICO;4;4;-;-
26013002001P9;INOVAÇÃO E DESENVOLVIMENTO;CENTRO UNIVERSITÁRIO DOS GUARARAPES;ADMINISTRAÇÃO PÚBLICA E DE EMPRESAS, CIÊNCIAS CONTÁBEIS E TURISMO;ADMINISTRAÇÃO;EM DESATIVACAO;PROFISSIONAL;-;-;3;-
42006015003P0;LETRAS;UNIVERSIDADE CATÓLICA DE PELOTAS;LINGUíSTICA E LITERATURA;LINGÜÍSTICA APLICADA;EM DESATIVACAO;ACADÊMICO;5;5;-;-
42043018001P5;LETRAS;CENTRO UNIVERSITÁRIO RITTER DOS REIS;LINGUíSTICA E LITERATURA;LETRAS;EM DESATIVACAO;ACADÊMICO;4;-;-;-
42041015008P7;LETRAS;UNIVERSIDADE FEEVALE;LINGUíSTICA E LITERATURA;LETRAS;EM DESATIVACAO;PROFISSIONAL;-;-;3;-
12008010006P0;Letras e Artes;UNIVERSIDADE DO ESTADO DO AMAZONAS;LINGUíSTICA E LITERATURA;LETRAS;EM DESATIVACAO;PROFISSIONAL;-;-;3;-
28001010017P2;LETRAS E LINGÜÍSTICA;UNIVERSIDADE FEDERAL DA BAHIA;LINGUíSTICA E LITERATURA;LETRAS;EM DESATIVACAO;ACADÊMICO;5;5;-;-
42008018012P1;Letras (UCS/UNIRITTER);CENTRO UNIVERSITÁRIO RITTER DOS REIS;LINGUíSTICA E LITERATURA;LETRAS;EM DESATIVACAO;ACADÊMICO;-;4;-;-
42008018012P1;Letras (UCS/UNIRITTER);UNIVERSIDADE DE CAXIAS DO SUL;LINGUíSTICA E LITERATURA;LETRAS;EM DESATIVACAO;ACADÊMICO;-;4;-;-
16003012008P9;Letras:Ensino de Língua e Literatura;FUNDAÇÃO UNIVERSIDADE FEDERAL DO TOCANTINS;LINGUíSTICA E LITERATURA;LETRAS;EM DESATIVACAO;ACADÊMICO;4;4;-;-
22001018050P0;LOGÍSTICA E PESQ. OPERACIONAL;UNIVERSIDADE FEDERAL DO CEARÁ;ENGENHARIAS III                                   ;ENGENHARIA DE PRODUÇÃO;EM DESATIVACAO;ACADÊMICO;2;-;-;-
30001013043P6;Medicina;UNIVERSIDADE FEDERAL DO ESPÍRITO SANTO;MEDICINA I                                        ;MEDICINA;EM DESATIVACAO;PROFISSIONAL;-;-;2;-
33002010059P4;MEDICINA (CLÍNICA CIRÚRGICA);UNIVERSIDADE DE SÃO PAULO;MEDICINA III                                      ;CIRURGIA;EM DESATIVACAO;ACADÊMICO;-;2;-;-
52001016067P4;Modelagem e Otimização;UNIVERSIDADE FEDERAL DE GOIÁS;INTERDISCIPLINAR                                  ;ENGENHARIA/TECNOLOGIA/GESTÃO;EM DESATIVACAO;ACADÊMICO;3;-;-;-
40024016001P2;ODONTOLOGIA;UNIVERSIDADE PITÁGORAS UNOPAR;ODONTOLOGIA                                       ;ODONTOLOGIA;EM DESATIVACAO;ACADÊMICO;4;4;-;-
28008014003P2;ODONTOLOGIA;ESCOLA BAHIANA DE MEDICINA E SAÚDE PÚBLICA;ODONTOLOGIA                                       ;ODONTOLOGIA;EM DESATIVACAO;PROFISSIONAL;-;-;3;-
51001012033P0;ODONTOLOGIA;FUNDAÇÃO UNIVERSIDADE FEDERAL DE MATO GROSSO DO SUL;ODONTOLOGIA                                       ;ODONTOLOGIA;EM DESATIVACAO;ACADÊMICO;2;-;-;-
33052018002P1;Odontologia;UNIVERSIDADE CIDADE DE SÃO PAULO;ODONTOLOGIA                                       ;ODONTOLOGIA;EM DESATIVACAO;PROFISSIONAL;-;-;3;-
40002012043P0;Odontologia;UNIVERSIDADE ESTADUAL DE LONDRINA;ODONTOLOGIA                                       ;ODONTOLOGIA;EM DESATIVACAO;ACADÊMICO;2;-;-;-
